<?xml version="1.0" encoding="UTF-8"?>
<!DOCTYPE matricula SYSTEM "matricula.dtd">
<matricula>
<personal>
<dni>12345678A</dni>
<nombre>Amparo García Gil</nombre>
<titulacion>Ingeniería Informática</titulacion>
<domicilios>
<domicilio tipo="familiar">
<direccion>C/ Principal no1</direccion>
<municipio>Murcia</municipio>
</domicilio>
<domicilio tipo="habitual">
<direccion>C/ Secundaria no2</direccion>
<municipio>Murcia</municipio>
</domicilio>
</domicilios>
</personal>
<pago>
<tipo_matricula>Matrícula Ordinaria</tipo_matricula>
<cantidad>950€</cantidad>
</pago>
</matricula>